ISSN,DOI,authors,year,title,journal,URL,citations,impact_factor_rank,category,year_for_citations_by_year,citations_per_year,more_than_20_citations_per_year,more_than_25_citations_per_year,more_than_30_citations_per_year
1046-1310,10.1007/s12144-022-02883-9,Khudaykulov; Changjun; Obrenovic; Godinic; Alsharif; Jakhongirov,2024,The fear of COVID-19 and job insecurity impact on depression and anxiety: An empirical study in China in the COVID-19 pandemic aftermath,Current Psychology,https://doi.org/10.1007/s12144-022-02883-9,48,250,"PSYCHOLOGY, MULTIDISCIPLINARY",2024,48,TRUE,TRUE,TRUE
0890-8567,10.1016/j.jaac.2021.08.021,Sheftall; Vakil; Ruch; Boyd; Lindsey; Bridge,2022,Black Youth Suicide: Investigation of Current Trends and Precipitating Circumstances,Journal of the American Academy of Child &amp; Adolescent Psychiatry,https://doi.org/10.1016/j.jaac.2021.08.021,136,10,"PSYCHOLOGY, DEVELOPMENTAL",2022,45.33,TRUE,TRUE,TRUE
1664-1078,10.3389/fpsyg.2019.00694,Stanisławski,2019,The Coping Circumplex Model: An Integrative Model of the Structure of Coping With Stress,Frontiers in Psychology,https://doi.org/10.3389/fpsyg.2019.00694,190,228,"PSYCHOLOGY, MULTIDISCIPLINARY",2019,31.67,TRUE,TRUE,TRUE
1048-9843,10.1016/j.leaqua.2016.02.006,Banks; McCauley; Gardner; Guler,2016,A meta-analytic review of authentic and transformational leadership: A test for redundancy,The Leadership Quarterly,https://doi.org/10.1016/j.leaqua.2016.02.006,395,11,"PSYCHOLOGY, APPLIED",2016,43.89,TRUE,TRUE,TRUE
0018-7208,10.1177/0018720816685832,Eriksson; Stanton,2017,Takeover Time in Highly Automated Vehicles: Noncritical Transitions to and From Manual Control,Human Factors: The Journal of the Human Factors and Ergonomics Society,https://doi.org/10.1177/0018720816685832,473,186,PSYCHOLOGY,2017,59.13,TRUE,TRUE,TRUE
1048-9843,10.1016/j.leaqua.2015.10.007,Chen; Hou,2016,"The effects of ethical leadership, voice behavior and climates for innovation on creativity: A moderated mediation examination",The Leadership Quarterly,https://doi.org/10.1016/j.leaqua.2015.10.007,339,11,"PSYCHOLOGY, APPLIED",2016,37.67,TRUE,TRUE,TRUE
1079-5014,10.1093/geronb/gbx087,Rafnsson; Orrell; d’Orsi; Hogervorst; Steptoe,2020,"Loneliness, Social Integration, and Incident Dementia Over 6 Years: Prospective Findings From the English Longitudinal Study of Ageing",The Journals of Gerontology: Series B,https://doi.org/10.1093/geronb/gbx087,172,46,PSYCHOLOGY,2020,34.4,TRUE,TRUE,TRUE
0272-4944,10.1016/j.jenvp.2021.101733,Newman; Gatersleben; Wyles; Ratcliffe,2022,The use of virtual reality in environment experiences and the importance of realism,Journal of Environmental Psychology,https://doi.org/10.1016/j.jenvp.2021.101733,96,23,"PSYCHOLOGY, MULTIDISCIPLINARY",2022,32,TRUE,TRUE,TRUE
8756-8225,10.1080/87568225.2021.1890298,Salimi; Gere; Talley; Irioogbe,2023,College Students Mental Health Challenges: Concerns and Considerations in the COVID-19 Pandemic,Journal of College Student Psychotherapy,https://doi.org/10.1080/87568225.2021.1890298,78,431,"PSYCHOLOGY, APPLIED",2023,39,TRUE,TRUE,TRUE
0145-2134,10.1016/j.chiabu.2015.01.011,Fox; Perez; Cass; Baglivio; Epps,2015,"Trauma changes everything: Examining the relationship between adverse childhood experiences and serious, violent and chronic juvenile offenders",Child Abuse &amp; Neglect,https://doi.org/10.1016/j.chiabu.2015.01.011,472,110,"PSYCHOLOGY, SOCIAL",2015,47.2,TRUE,TRUE,TRUE
1554-3528,10.3758/s13428-021-01694-3,Peer; Rothschild; Gordon; Evernden; Damer,2021,Data quality of platforms and panels for online behavioral research,Behavior Research Methods,https://doi.org/10.3758/s13428-021-01694-3,560,55,"PSYCHOLOGY, EXPERIMENTAL",2021,140,TRUE,TRUE,TRUE
1930-7810,10.1037/hea0000586,Hornsey; Harris; Fielding,2018,The psychological roots of anti-vaccination attitudes: A 24-nation investigation.,Health Psychology,https://doi.org/10.1037/hea0000586,478,150,PSYCHOLOGY,2018,68.29,TRUE,TRUE,TRUE
0149-2063,10.1177/0149206315575554,Kurtessis; Eisenberger; Ford; Buffardi; Stewart; Adis,2017,Perceived Organizational Support: A Meta-Analytic Evaluation of Organizational Support Theory,Journal of Management,https://doi.org/10.1177/0149206315575554,975,9,"PSYCHOLOGY, APPLIED",2017,121.88,TRUE,TRUE,TRUE
2397-3374,10.1038/s41562-021-01196-4,Yang; Holtz; Jaffe; Suri; Sinha; Weston; Joyce; Shah; Sherman; Hecht; Teevan,2021,The effects of remote work on collaboration among information workers,Nature Human Behaviour,https://doi.org/10.1038/s41562-021-01196-4,345,1,"PSYCHOLOGY, EXPERIMENTAL",2021,86.25,TRUE,TRUE,TRUE
0003-5033,10.3917/anpsy1.201.0073,van den Bergh; van Doorn; Marsman; Draws; van Kesteren; Derks; Dablander; Gronau; Kucharský; Gupta; Sarafoglou; Voelkel; Stefan; Ly; Hinne; Matzke; Wagenmakers,2020,A Tutorial on Conducting and Interpreting a Bayesian ANOVA in JASP,L’Année psychologique,https://doi.org/10.3917/anpsy1.201.0073,178,729,"PSYCHOLOGY, MULTIDISCIPLINARY",2020,35.6,TRUE,TRUE,TRUE
1073-1911,10.1177/1073191119887449,Zanon; Brenner; Baptista; Vogel; Rubin; Al-Darmaki; Gonçalves; Heath; Liao; Mackenzie; Topkaya; Wade; Zlati,2021,"Examining the Dimensionality, Reliability, and Invariance of the Depression, Anxiety, and Stress Scale–21 (DASS-21) Across Eight Countries",Assessment,https://doi.org/10.1177/1073191119887449,182,106,"PSYCHOLOGY, CLINICAL",2021,45.5,TRUE,TRUE,TRUE
1015-5759,10.1027/1015-5759/a000430,Schaufeli; Shimazu; Hakanen; Salanova; De Witte,2019,An Ultra-Short Measure for Work Engagement,European Journal of Psychological Assessment,https://doi.org/10.1027/1015-5759/a000430,427,141,"PSYCHOLOGY, APPLIED",2019,71.17,TRUE,TRUE,TRUE
1554-3528,10.3758/s13428-017-0935-1,Hedge; Powell; Sumner,2018,The reliability paradox: Why robust cognitive tasks do not produce reliable individual differences,Behavior Research Methods,https://doi.org/10.3758/s13428-017-0935-1,832,55,"PSYCHOLOGY, EXPERIMENTAL",2018,118.86,TRUE,TRUE,TRUE
0022-1031,10.1016/j.jesp.2017.03.009,Mogan; Fischer; Bulbulia,2017,"To be in synchrony or not? A meta-analysis of synchrony's effects on behavior, perception, cognition and affect",Journal of Experimental Social Psychology,https://doi.org/10.1016/j.jesp.2017.03.009,249,140,"PSYCHOLOGY, SOCIAL",2017,31.13,TRUE,TRUE,TRUE
0162-3257,10.1007/s10803-020-04615-z,Wood-Downie; Wong; Kovshoff; Mandy; Hull; Hadwin,2021,Sex/Gender Differences in Camouflaging in Children and Adolescents with Autism,Journal of Autism and Developmental Disorders,https://doi.org/10.1007/s10803-020-04615-z,124,152,"PSYCHOLOGY, DEVELOPMENTAL",2021,31,TRUE,TRUE,TRUE
0306-4603,10.1016/j.addbeh.2017.05.005,Latkin; Edwards; Davey-Rothwell; Tobin,2017,"The relationship between social desirability bias and self-reports of health, substance use, and social network factors among urban substance users in Baltimore, Maryland",Addictive Behaviors,https://doi.org/10.1016/j.addbeh.2017.05.005,411,90,"PSYCHOLOGY, CLINICAL",2017,51.38,TRUE,TRUE,TRUE
0149-2063,10.1177/0149206316680030,Bundy; Pfarrer; Short; Coombs,2017,"Crises and Crisis Management: Integration, Interpretation, and Research Development",Journal of Management,https://doi.org/10.1177/0149206316680030,643,9,"PSYCHOLOGY, APPLIED",2017,80.38,TRUE,TRUE,TRUE
1939-2222,10.1037/xge0000083,Carter; Kofler; Forster; McCullough,2015,A series of meta-analytic tests of the depletion effect: Self-control does not seem to rely on a limited resource.,Journal of Experimental Psychology: General,https://doi.org/10.1037/xge0000083,363,91,"PSYCHOLOGY, EXPERIMENTAL",2015,36.3,TRUE,TRUE,TRUE
0956-7976,10.1177/0956797617723724,Anderson; Kelley; Maxwell,2017,Sample-Size Planning for More Accurate Statistical Power: A Method Adjusting Sample Effect Sizes for Publication Bias and Uncertainty,Psychological Science,https://doi.org/10.1177/0956797617723724,258,44,"PSYCHOLOGY, MULTIDISCIPLINARY",2017,32.25,TRUE,TRUE,TRUE
2474-7394,10.1525/collabra.33267,Lakens,2022,Sample Size Justification,Collabra: Psychology,https://doi.org/10.1525/collabra.33267,551,146,"PSYCHOLOGY, MULTIDISCIPLINARY",2022,183.67,TRUE,TRUE,TRUE
1743-9760,10.1080/17439760.2020.1805501,Lomas; Waters; Williams; Oades; Kern,2021,Third wave positive psychology: broadening towards complexity,The Journal of Positive Psychology,https://doi.org/10.1080/17439760.2020.1805501,170,117,"PSYCHOLOGY, MULTIDISCIPLINARY",2021,42.5,TRUE,TRUE,TRUE
1554-3528,10.3758/s13428-019-01246-w,Mair; Wilcox,2020,Robust statistical methods in R using the WRS2 package,Behavior Research Methods,https://doi.org/10.3758/s13428-019-01246-w,653,55,"PSYCHOLOGY, EXPERIMENTAL",2020,130.6,TRUE,TRUE,TRUE
1018-8827,10.1007/s00787-021-01739-0,Calvano; Engelke; Di Bella; Kindermann; Renneberg; Winter,2022,"Families in the COVID-19 pandemic: parental stress, parent mental health and the occurrence of adverse childhood experiences—results of a representative survey in Germany",European Child &amp; Adolescent Psychiatry,https://doi.org/10.1007/s00787-021-01739-0,235,24,"PSYCHOLOGY, DEVELOPMENTAL",2022,78.33,TRUE,TRUE,TRUE
0144-6665,10.1111/bjso.12251,Manstead,2018,"The psychology of social class: How socioeconomic status impacts thought, feelings, and behaviour",British Journal of Social Psychology,https://doi.org/10.1111/bjso.12251,407,134,"PSYCHOLOGY, SOCIAL",2018,58.14,TRUE,TRUE,TRUE
0272-4944,10.1016/j.jenvp.2021.101581,Wallis; Loy,2021,What drives pro-environmental activism of young people? A survey study on the Fridays For Future movement,Journal of Environmental Psychology,https://doi.org/10.1016/j.jenvp.2021.101581,148,23,"PSYCHOLOGY, MULTIDISCIPLINARY",2021,37,TRUE,TRUE,TRUE
1866-2625,10.1007/s12310-022-09533-2,Robinson; Valido; Drescher; Woolweaver; Espelage; LoMurray; Long; Wright; Dailey,2023,"Teachers, Stress, and the COVID-19 Pandemic: A Qualitative Analysis",School Mental Health,https://doi.org/10.1007/s12310-022-09533-2,89,252,"PSYCHOLOGY, DEVELOPMENTAL",2023,44.5,TRUE,TRUE,TRUE
0160-7715,10.1007/s10865-016-9782-2,Leventhal; Phillips; Burns,2016,The Common-Sense Model of Self-Regulation (CSM): a dynamic framework for understanding illness self-management,Journal of Behavioral Medicine,https://doi.org/10.1007/s10865-016-9782-2,787,198,"PSYCHOLOGY, CLINICAL",2016,87.44,TRUE,TRUE,TRUE
1469-0292,10.1016/j.psychsport.2018.08.015,Pontifex; McGowan; Chandler; Gwizdala; Parks; Fenn; Kamijo,2019,A primer on investigating the after effects of acute bouts of physical activity on cognition,Psychology of Sport and Exercise,https://doi.org/10.1016/j.psychsport.2018.08.015,210,151,PSYCHOLOGY,2019,35,TRUE,TRUE,TRUE
0033-2917,10.1017/s0033291714002888,Erskine; Moffitt; Copeland; Costello; Ferrari; Patton; Degenhardt; Vos; Whiteford; Scott,2015,A heavy burden on young minds: the global burden of mental and substance use disorders in children and youth,Psychological Medicine,https://doi.org/10.1017/s0033291714002888,455,26,PSYCHOLOGY,2015,45.5,TRUE,TRUE,TRUE
1368-4302,10.1177/1368430220982068,Douglas,2021,COVID-19 conspiracy theories,Group Processes &amp; Intergroup Relations,https://doi.org/10.1177/1368430220982068,247,71,"PSYCHOLOGY, SOCIAL",2021,61.75,TRUE,TRUE,TRUE
2397-3374,10.1038/s41562-017-0279-y,Davies; Dickson; Davey Smith; van den Berg; Windmeijer,2018,The causal effects of education on health outcomes in the UK Biobank,Nature Human Behaviour,https://doi.org/10.1038/s41562-017-0279-y,218,1,"PSYCHOLOGY, EXPERIMENTAL",2018,31.14,TRUE,TRUE,TRUE
0022-1031,10.1016/j.jesp.2015.07.006,Curran,2016,Methods for the detection of carelessly invalid responses in survey data,Journal of Experimental Social Psychology,https://doi.org/10.1016/j.jesp.2015.07.006,702,140,"PSYCHOLOGY, SOCIAL",2016,78,TRUE,TRUE,TRUE
0890-8567,10.1016/j.jaac.2014.10.010,Avenevoli; Swendsen; He; Burstein; Merikangas,2015,"Major Depression in the National Comorbidity Survey–Adolescent Supplement: Prevalence, Correlates, and Treatment",Journal of the American Academy of Child &amp; Adolescent Psychiatry,https://doi.org/10.1016/j.jaac.2014.10.010,847,10,"PSYCHOLOGY, DEVELOPMENTAL",2015,84.7,TRUE,TRUE,TRUE
0742-6046,10.1002/mar.21532,Belanche; Casaló; Schepers; Flavián,2021,"Examining the effects of robots' physical appearance, warmth, and competence in frontline services: The Humanness‐Value‐Loyalty model",Psychology &amp; Marketing,https://doi.org/10.1002/mar.21532,188,14,"PSYCHOLOGY, APPLIED",2021,47,TRUE,TRUE,TRUE
1939-1315,10.1037/pspp0000096,Soto; John,2017,"The next Big Five Inventory (BFI-2): Developing and assessing a hierarchical model with 15 facets to enhance bandwidth, fidelity, and predictive power.",Journal of Personality and Social Psychology,https://doi.org/10.1037/pspp0000096,1083,20,"PSYCHOLOGY, SOCIAL",2017,135.38,TRUE,TRUE,TRUE
0149-2063,10.1177/0149206312455246,Halbesleben; Wheeler,2015,To Invest or Not? The Role of Coworker Support and Trust in Daily Reciprocal Gain Spirals of Helping Behavior,Journal of Management,https://doi.org/10.1177/0149206312455246,308,9,"PSYCHOLOGY, APPLIED",2015,30.8,TRUE,TRUE,TRUE
2050-7283,10.1186/s40359-018-0249-9,Kocalevent; Berg; Beutel; Hinz; Zenger; Härter; Nater; Brähler,2018,Social support in the general population: standardization of the Oslo social support scale (OSSS-3),BMC Psychology,https://doi.org/10.1186/s40359-018-0249-9,369,208,"PSYCHOLOGY, MULTIDISCIPLINARY",2018,52.71,TRUE,TRUE,TRUE
1758-0846,10.1111/aphw.12262,Zampetakis; Melas,2021,The health belief model predicts vaccination intentions against COVID‐19: A survey experiment approach,Applied Psychology: Health and Well-Being,https://doi.org/10.1111/aphw.12262,135,84,"PSYCHOLOGY, APPLIED",2021,33.75,TRUE,TRUE,TRUE
2573-9581,10.1089/aut.2019.0079,Raymaker; Teo; Steckler; Lentz; Scharer; Delos Santos; Kapp; Hunter; Joyce; Nicolaidis,2020,“Having All of Your Internal Resources Exhausted Beyond Measure and Being Left with No Clean-Up Crew”: Defining Autistic Burnout,Autism in Adulthood,https://doi.org/10.1089/aut.2019.0079,185,6,"PSYCHOLOGY, DEVELOPMENTAL",2020,37,TRUE,TRUE,TRUE
1088-8691,10.1080/10888691.2018.1537791,Darling-Hammond; Flook; Cook-Harvey; Barron; Osher,2020,Implications for educational practice of the science of learning and development,Applied Developmental Science,https://doi.org/10.1080/10888691.2018.1537791,802,464,"PSYCHOLOGY, DEVELOPMENTAL",2020,160.4,TRUE,TRUE,TRUE
1557-1874,10.1007/s11469-020-00330-z,Gritsenko; Skugarevsky; Konstantinov; Khamenka; Marinova; Reznik; Isralowitz,2021,"COVID 19 Fear, Stress, Anxiety, and Substance Use Among Russian and Belarusian University Students",International Journal of Mental Health and Addiction,https://doi.org/10.1007/s11469-020-00330-z,206,131,"PSYCHOLOGY, CLINICAL",2021,51.5,TRUE,TRUE,TRUE
2397-3374,10.1038/s41562-021-01082-z,Hansen; Markello; Vogel; Seidlitz; Bzdok; Misic,2021,Mapping gene transcription and neurocognition across human neocortex,Nature Human Behaviour,https://doi.org/10.1038/s41562-021-01082-z,128,1,"PSYCHOLOGY, EXPERIMENTAL",2021,32,TRUE,TRUE,TRUE
0887-0446,10.1080/08870446.2017.1325890,West,2017,"Tobacco smoking: Health impact, prevalence, correlates and interventions",Psychology &amp; Health,https://doi.org/10.1080/08870446.2017.1325890,419,276,"PSYCHOLOGY, MULTIDISCIPLINARY",2017,52.38,TRUE,TRUE,TRUE
0887-6185,10.1016/j.janxdis.2020.102196,Asmundson; Taylor,2020,Coronaphobia: Fear and the 2019-nCoV outbreak,Journal of Anxiety Disorders,https://doi.org/10.1016/j.janxdis.2020.102196,620,45,"PSYCHOLOGY, CLINICAL",2020,124,TRUE,TRUE,TRUE
2327-9095,10.1080/23279095.2015.1004574,Whiteside; Kealey; Semla; Luu; Rice; Basso; Roper,2016,Verbal Fluency: Language or Executive Function Measure?,Applied Neuropsychology: Adult,https://doi.org/10.1080/23279095.2015.1004574,284,542,PSYCHOLOGY,2016,31.56,TRUE,TRUE,TRUE
1878-7304,10.1037/cap0000251,Dozois; NA,2021,Anxiety and depression in Canada during the COVID-19 pandemic: A national survey.,Canadian Psychology / Psychologie canadienne,https://doi.org/10.1037/cap0000251,132,176,"PSYCHOLOGY, MULTIDISCIPLINARY",2021,33,TRUE,TRUE,TRUE
1664-1078,10.3389/fpsyg.2016.01832,Wicherts; Veldkamp; Augusteijn; Bakker; van Aert; van Assen,2016,"Degrees of Freedom in Planning, Running, Analyzing, and Reporting Psychological Studies: A Checklist to Avoid p-Hacking",Frontiers in Psychology,https://doi.org/10.3389/fpsyg.2016.01832,429,228,"PSYCHOLOGY, MULTIDISCIPLINARY",2016,47.67,TRUE,TRUE,TRUE
1939-1463,10.1037/met0000195,Arend; Schäfer,2019,Statistical power in two-level models: A tutorial based on Monte Carlo simulation.,Psychological Methods,https://doi.org/10.1037/met0000195,363,17,"PSYCHOLOGY, MULTIDISCIPLINARY",2019,60.5,TRUE,TRUE,TRUE
1015-5759,10.1027/1015-5759/a000602,Paulhus; Buckels; Trapnell; Jones,2021,Screening for Dark Personalities,European Journal of Psychological Assessment,https://doi.org/10.1027/1015-5759/a000602,150,141,"PSYCHOLOGY, APPLIED",2021,37.5,TRUE,TRUE,TRUE
2000-8066,10.1080/20008198.2017.1353383,Kessler; Aguilar-Gaxiola; Alonso; Benjet; Bromet; Cardoso; Degenhardt; de Girolamo; Dinolova; Ferry; Florescu; Gureje; Haro; Huang; Karam; Kawakami; Lee; Lepine; Levinson; Navarro-Mateu; Pennell; Piazza; Posada-Villa; Scott; Stein; Ten Have; Torres; Viana; Petukhova; Sampson; Zaslavsky; Koenen,2017,Trauma and PTSD in the WHO World Mental Health Surveys,European Journal of Psychotraumatology,https://doi.org/10.1080/20008198.2017.1353383,935,67,"PSYCHOLOGY, CLINICAL",2017,116.88,TRUE,TRUE,TRUE
1664-1078,10.3389/fpsyg.2023.1260843,Song; Song,2023,Enhancing academic writing skills and motivation: assessing the efficacy of ChatGPT in AI-assisted language learning for EFL students,Frontiers in Psychology,https://doi.org/10.3389/fpsyg.2023.1260843,73,228,"PSYCHOLOGY, MULTIDISCIPLINARY",2023,36.5,TRUE,TRUE,TRUE
0021-9630,10.1111/jcpp.13445,Li; Cui; Li; Guo; Ke; Liu; Luo; Zheng; Leckman,2022,"Prevalence of mental disorders in school children and adolescents in China: diagnostic data from detailed clinical assessments of 17,524 individuals",Journal of Child Psychology and Psychiatry,https://doi.org/10.1111/jcpp.13445,208,19,PSYCHOLOGY,2022,69.33,TRUE,TRUE,TRUE
0894-9867,10.1002/jts.22600,Rudenstine; McNeal; Schulder; Ettman; Hernandez; Gvozdieva; Galea,2021,"Depression and Anxiety During the COVID‐19 Pandemic in an Urban, Low‐Income Public University Sample",Journal of Traumatic Stress,https://doi.org/10.1002/jts.22600,167,278,"PSYCHOLOGY, CLINICAL",2021,41.75,TRUE,TRUE,TRUE
0885-7482,10.1007/s10896-020-00172-2,Griffith,2022,Parental Burnout and Child Maltreatment During the COVID-19 Pandemic,Journal of Family Violence,https://doi.org/10.1007/s10896-020-00172-2,311,206,"PSYCHOLOGY, CLINICAL",2022,103.67,TRUE,TRUE,TRUE
1939-1854,10.1037/apl0000128,Mathieu; Hollenbeck; van Knippenberg; Ilgen,2017,A century of work teams in the Journal of Applied Psychology.,Journal of Applied Psychology,https://doi.org/10.1037/apl0000128,355,7,"PSYCHOLOGY, APPLIED",2017,44.38,TRUE,TRUE,TRUE
1939-1463,10.1037/met0000045,Rodriguez; Reise; Haviland,2016,Evaluating bifactor models: Calculating and interpreting statistical indices.,Psychological Methods,https://doi.org/10.1037/met0000045,916,17,"PSYCHOLOGY, MULTIDISCIPLINARY",2016,101.78,TRUE,TRUE,TRUE
0894-3796,10.1002/job.1962,DeSimone; Harms; DeSimone,2015,Best practice recommendations for data screening,Journal of Organizational Behavior,https://doi.org/10.1002/job.1962,399,22,"PSYCHOLOGY, APPLIED",2015,39.9,TRUE,TRUE,TRUE
1054-139X,10.1016/j.jadohealth.2020.11.010,Scott; Rivera; Rushing; Manczak; Rozek; Doom,2021,“I Hate This”: A Qualitative Analysis of Adolescents' Self-Reported Challenges During the COVID-19 Pandemic,Journal of Adolescent Health,https://doi.org/10.1016/j.jadohealth.2020.11.010,125,30,"PSYCHOLOGY, DEVELOPMENTAL",2021,31.25,TRUE,TRUE,TRUE
0001-8791,10.1016/j.jvb.2018.06.003,Settles; Buchanan; Dotson,2019,Scrutinized but not recognized: (In)visibility and hypervisibility experiences of faculty of color,Journal of Vocational Behavior,https://doi.org/10.1016/j.jvb.2018.06.003,214,35,"PSYCHOLOGY, APPLIED",2019,35.67,TRUE,TRUE,TRUE
1079-5014,10.1093/geronb/gbaa051,Ayalon; Chasteen; Diehl; Levy; Neupert; Rothermund; Tesch-Römer; Wahl,2021,Aging in Times of the COVID-19 Pandemic: Avoiding Ageism and Fostering Intergenerational Solidarity,The Journals of Gerontology: Series B,https://doi.org/10.1093/geronb/gbaa051,372,46,PSYCHOLOGY,2021,93,TRUE,TRUE,TRUE
0889-3268,10.1007/s10869-018-9552-y,Walter; Seibert; Goering; O’Boyle,2019,A Tale of Two Sample Sources: Do Results from Online Panel Data and Conventional Data Converge?,Journal of Business and Psychology,https://doi.org/10.1007/s10869-018-9552-y,381,93,"PSYCHOLOGY, APPLIED",2019,63.5,TRUE,TRUE,TRUE
1554-3528,10.3758/s13428-017-0862-1,Epskamp; Borsboom; Fried,2018,Estimating psychological networks and their accuracy: A tutorial paper,Behavior Research Methods,https://doi.org/10.3758/s13428-017-0862-1,2493,55,"PSYCHOLOGY, EXPERIMENTAL",2018,356.14,TRUE,TRUE,TRUE
1939-1315,10.1037/pspp0000265,Harris; Orth,2020,The link between self-esteem and social relationships: A meta-analysis of longitudinal studies.,Journal of Personality and Social Psychology,https://doi.org/10.1037/pspp0000265,263,20,"PSYCHOLOGY, SOCIAL",2020,52.6,TRUE,TRUE,TRUE
1040-0419,10.1080/10400419.2022.2107850,Wingström; Hautala; Lundman,2024,Redefining Creativity in the Era of AI? Perspectives of Computer Scientists and New Media Artists,Creativity Research Journal,https://doi.org/10.1080/10400419.2022.2107850,37,253,"PSYCHOLOGY, EDUCATIONAL",2024,37,TRUE,TRUE,TRUE
0033-3190,10.1159/000484413,Henningsen; Zipfel; Sattel; Creed,2018,Management of Functional Somatic Syndromes and Bodily Distress,Psychotherapy and Psychosomatics,https://doi.org/10.1159/000484413,222,2,PSYCHOLOGY,2018,31.71,TRUE,TRUE,TRUE
2398-063X,10.1017/bpp.2020.50,CHRISTENSEN; MOYNIHAN,2024,Motivated reasoning and policy information: politicians are more resistant to debiasing interventions than the general public,Behavioural Public Policy,https://doi.org/10.1017/bpp.2020.50,33,40,"PSYCHOLOGY, APPLIED",2024,33,TRUE,TRUE,TRUE
1018-8827,10.1007/s00787-021-01871-x,Coghill; Banaschewski; Cortese; Asherson; Brandeis; Buitelaar; Daley; Danckaerts; Dittmann; Doepfner; Ferrin; Hollis; Holtmann; Paramala; Sonuga-Barke; Soutullo; Steinhausen; Van der Oord; Wong; Zuddas; Simonoff,2023,The management of ADHD in children and adolescents: bringing evidence to the clinic: perspective from the European ADHD Guidelines Group (EAGG),European Child &amp; Adolescent Psychiatry,https://doi.org/10.1007/s00787-021-01871-x,73,24,"PSYCHOLOGY, DEVELOPMENTAL",2023,36.5,TRUE,TRUE,TRUE
0001-8791,10.1016/j.jvb.2019.06.004,Lent; Brown,2019,"Social cognitive career theory at 25: Empirical status of the interest, choice, and performance models",Journal of Vocational Behavior,https://doi.org/10.1016/j.jvb.2019.06.004,223,35,"PSYCHOLOGY, APPLIED",2019,37.17,TRUE,TRUE,TRUE
0146-6216,10.1177/0146621616677520,Christensen; Makransky; Horton,2017,Critical Values for Yen’s Q3: Identification of Local Dependence in the Rasch Model Using Residual Correlations,Applied Psychological Measurement,https://doi.org/10.1177/0146621616677520,444,622,"PSYCHOLOGY, MATHEMATICAL",2017,55.5,TRUE,TRUE,TRUE
1662-5161,10.3389/fnhum.2018.00505,Pinti; Scholkmann; Hamilton; Burgess; Tachtsidis,2019,Current Status and Issues Regarding Pre-processing of fNIRS Neuroimaging Data: An Investigation of Diverse Signal Filtering Methods Within a General Linear Model Framework,Frontiers in Human Neuroscience,https://doi.org/10.3389/fnhum.2018.00505,271,282,PSYCHOLOGY,2019,45.17,TRUE,TRUE,TRUE
0748-1187,10.1080/07481187.2020.1784311,Yıldırım; Güler,2022,Factor analysis of the COVID-19 Perceived Risk Scale: A preliminary study,Death Studies,https://doi.org/10.1080/07481187.2020.1784311,118,331,"PSYCHOLOGY, MULTIDISCIPLINARY",2022,39.33,TRUE,TRUE,TRUE
2054-4642,10.1093/workar/wax032,Fisher; Ryan,2018,Overview of the Health and Retirement Study and Introduction to the Special Issue,"Work, Aging and Retirement",https://doi.org/10.1093/workar/wax032,245,209,"PSYCHOLOGY, APPLIED",2018,35,TRUE,TRUE,TRUE
1094-4281,10.1177/1094428115584005,Dul,2016,Necessary Condition Analysis (NCA),Organizational Research Methods,https://doi.org/10.1177/1094428115584005,572,13,"PSYCHOLOGY, APPLIED",2016,63.56,TRUE,TRUE,TRUE
0149-2063,10.1177/0149206316628643,Hoobler; Masterson; Nkomo; Michel,2018,"The Business Case for Women Leaders: Meta-Analysis, Research Critique, and Path Forward",Journal of Management,https://doi.org/10.1177/0149206316628643,245,9,"PSYCHOLOGY, APPLIED",2018,35,TRUE,TRUE,TRUE
1018-8827,10.1007/s00787-020-01541-4,Zhou; Zhang; Wang; Guo; Wang; Chen; Liu; Chen; Chen,2020,Prevalence and socio-demographic correlates of psychological health problems in Chinese adolescents during the outbreak of COVID-19,European Child &amp; Adolescent Psychiatry,https://doi.org/10.1007/s00787-020-01541-4,980,24,"PSYCHOLOGY, DEVELOPMENTAL",2020,196,TRUE,TRUE,TRUE
1087-0547,10.1177/1087054714566076,Arnold; Hodgkins; Kahle; Madhoo; Kewley,2020,Long-Term Outcomes of ADHD: Academic Achievement and Performance,Journal of Attention Disorders,https://doi.org/10.1177/1087054714566076,289,217,"PSYCHOLOGY, DEVELOPMENTAL",2020,57.8,TRUE,TRUE,TRUE
0890-8567,10.1016/j.jaac.2019.10.011,LeMoult; Humphreys; Tracy; Hoffmeister; Ip; Gotlib,2020,Meta-analysis: Exposure to Early Life Stress and Risk for Depression in Childhood and Adolescence,Journal of the American Academy of Child &amp; Adolescent Psychiatry,https://doi.org/10.1016/j.jaac.2019.10.011,379,10,"PSYCHOLOGY, DEVELOPMENTAL",2020,75.8,TRUE,TRUE,TRUE
0160-6689,10.4088/jcp.15m10393,Eddy; Tabri; Thomas; Murray; Keshaviah; Hastings; Edkins; Krishna; Herzog; Keel; Franko,2017,Recovery From Anorexia Nervosa and Bulimia Nervosa at 22-Year Follow-Up,The Journal of Clinical Psychiatry,https://doi.org/10.4088/jcp.15m10393,319,59,"PSYCHOLOGY, CLINICAL",2017,39.88,TRUE,TRUE,TRUE
