ISSN,DOI,authors,year,title,journal,URL,citations,impact_factor_rank,category,year_for_citations_by_year,citations_per_year,more_than_20_citations_per_year,more_than_25_citations_per_year,more_than_30_citations_per_year
0306-4603,10.1016/j.addbeh.2018.01.021,Potvin; Pelletier; Grot; Hébert; Barr; Lecomte,2018,Cognitive deficits in individuals with methamphetamine use disorder: A meta-analysis,Addictive Behaviors,https://doi.org/10.1016/j.addbeh.2018.01.021,223,90,"PSYCHOLOGY, CLINICAL",2018,31.86,TRUE,TRUE,TRUE
1554-3528,10.3758/s13428-019-01293-3,Carpenter; Pogacar; Pullig; Kouril; Aguilar; LaBouff; Isenberg; Chakroff,2019,Survey-software implicit association tests: A methodological and empirical analysis,Behavior Research Methods,https://doi.org/10.3758/s13428-019-01293-3,181,55,"PSYCHOLOGY, EXPERIMENTAL",2019,30.17,TRUE,TRUE,TRUE
2214-7829,10.1016/j.invent.2018.03.008,Andersson,2018,"Internet interventions: Past, present and future",Internet Interventions,https://doi.org/10.1016/j.invent.2018.03.008,214,102,"PSYCHOLOGY, CLINICAL",2018,30.57,TRUE,TRUE,TRUE
0009-3920,10.1111/cdev.12864,Taylor; Oberle; Durlak; Weissberg,2017,Promoting Positive Youth Development Through School‐Based Social and Emotional Learning Interventions: A Meta‐Analysis of Follow‐Up Effects,Child Development,https://doi.org/10.1111/cdev.12864,1209,79,"PSYCHOLOGY, DEVELOPMENTAL",2017,151.13,TRUE,TRUE,TRUE
0162-895X,10.1111/pops.12337,Boutyline; Willer,2017,The Social Structure of Political Echo Chambers: Variation in Ideological Homophily in Online Networks,Political Psychology,https://doi.org/10.1111/pops.12337,274,69,"PSYCHOLOGY, SOCIAL",2017,34.25,TRUE,TRUE,TRUE
2167-7026,10.1177/2167702616628523,Beck; Bredemeier,2016,A Unified Model of Depression,Clinical Psychological Science,https://doi.org/10.1177/2167702616628523,334,47,PSYCHOLOGY,2016,37.11,TRUE,TRUE,TRUE
0747-5632,10.1016/j.chb.2018.08.020,Elhai; Levine; Alghraibeh; Alafnan; Aldraiweesh; Hall,2018,"Fear of missing out: Testing relationships with negative affectivity, online social engagement, and problematic smartphone use",Computers in Human Behavior,https://doi.org/10.1016/j.chb.2018.08.020,233,12,"PSYCHOLOGY, EXPERIMENTAL",2018,33.29,TRUE,TRUE,TRUE
1059-6011,10.1177/1059601121999580,Shore; Chung,2022,Inclusive Leadership: How Leaders Sustain or Discourage Work Group Inclusion,Group &amp; Organization Management,https://doi.org/10.1177/1059601121999580,97,72,"PSYCHOLOGY, APPLIED",2022,32.33,TRUE,TRUE,TRUE
1936-2293,10.1037/a0038550,Hillhouse; Porter,2015,A brief history of the development of antidepressant drugs: From monoamines to glutamate.,Experimental and Clinical Psychopharmacology,https://doi.org/10.1037/a0038550,387,274,"PSYCHOLOGY, BIOLOGICAL",2015,38.7,TRUE,TRUE,TRUE
0956-7976,10.1177/0956797614557867,Eichstaedt; Schwartz; Kern; Park; Labarthe; Merchant; Jha; Agrawal; Dziurzynski; Sap; Weeg; Larson; Ungar; Seligman,2015,Psychological Language on Twitter Predicts County-Level Heart Disease Mortality,Psychological Science,https://doi.org/10.1177/0956797614557867,339,44,"PSYCHOLOGY, MULTIDISCIPLINARY",2015,33.9,TRUE,TRUE,TRUE
0144-6665,10.1111/bjso.12394,Jolley; Paterson,2020,Pylons ablaze: Examining the role of 5G COVID‐19 conspiracy beliefs and support for violence,British Journal of Social Psychology,https://doi.org/10.1111/bjso.12394,253,134,"PSYCHOLOGY, SOCIAL",2020,50.6,TRUE,TRUE,TRUE
0033-2917,10.1017/s0033291715002706,Ayers; Bond; Bertullies; Wijma,2016,The aetiology of post-traumatic stress following childbirth: a meta-analysis and theoretical framework,Psychological Medicine,https://doi.org/10.1017/s0033291715002706,392,26,PSYCHOLOGY,2016,43.56,TRUE,TRUE,TRUE
0747-5632,10.1016/j.chb.2017.01.047,Costa; Fonseca; Santana; de Araújo; Rego,2017,Evaluating the effectiveness of educational data mining techniques for early prediction of students' academic failure in introductory programming courses,Computers in Human Behavior,https://doi.org/10.1016/j.chb.2017.01.047,264,12,"PSYCHOLOGY, EXPERIMENTAL",2017,33,TRUE,TRUE,TRUE
0013-1644,10.1177/0013164419885164,Shi; Maydeu-Olivares,2020,The Effect of Estimation Methods on SEM Fit Indices,Educational and Psychological Measurement,https://doi.org/10.1177/0013164419885164,173,345,"PSYCHOLOGY, EDUCATIONAL",2020,34.6,TRUE,TRUE,TRUE
1939-2176,10.1037/edu0000098,Yeager; Romero; Paunesku; Hulleman; Schneider; Hinojosa; Lee; O'Brien; Flint; Roberts; Trott; Greene; Walton; Dweck,2016,Using design thinking to improve psychological interventions: The case of the growth mindset during the transition to high school.,Journal of Educational Psychology,https://doi.org/10.1037/edu0000098,432,28,"PSYCHOLOGY, EDUCATIONAL",2016,48,TRUE,TRUE,TRUE
1664-1078,10.3389/fpsyg.2016.00121,Fielding; Hornsey,2016,A Social Identity Analysis of Climate Change and Environmental Attitudes and Behaviors: Insights and Opportunities,Frontiers in Psychology,https://doi.org/10.3389/fpsyg.2016.00121,309,228,"PSYCHOLOGY, MULTIDISCIPLINARY",2016,34.33,TRUE,TRUE,TRUE
2397-3374,10.1038/s41562-020-01044-x,Munzert; Selb; Gohdes; Stoetzer; Lowe,2021,Tracking and promoting the usage of a COVID-19 contact tracing app,Nature Human Behaviour,https://doi.org/10.1038/s41562-020-01044-x,165,1,"PSYCHOLOGY, EXPERIMENTAL",2021,41.25,TRUE,TRUE,TRUE
1939-134X,10.1037/pas0000209,Disabato; Goodman; Kashdan; Short; Jarden,2016,Different types of well-being? A cross-cultural examination of hedonic and eudaimonic well-being.,Psychological Assessment,https://doi.org/10.1037/pas0000209,351,123,"PSYCHOLOGY, CLINICAL",2016,39,TRUE,TRUE,TRUE
0747-5632,10.1016/j.chb.2017.08.038,Thomas; Clifford,2017,Validity and Mechanical Turk: An assessment of exclusion methods and interactive experiments,Computers in Human Behavior,https://doi.org/10.1016/j.chb.2017.08.038,452,12,"PSYCHOLOGY, EXPERIMENTAL",2017,56.5,TRUE,TRUE,TRUE
0894-3796,10.1002/job.2375,Kleine; Rudolph; Zacher,2019,Thriving at work: A meta‐analysis,Journal of Organizational Behavior,https://doi.org/10.1002/job.2375,319,22,"PSYCHOLOGY, APPLIED",2019,53.17,TRUE,TRUE,TRUE
0439-755X,10.3724/sp.j.1041.2024.00447,ZHANG; PI; LI,2024,Individual and collective temporal self-evaluation: Evidence from behavior and ERP,Acta Psychologica Sinica,https://doi.org/10.3724/sp.j.1041.2024.00447,41,560,"PSYCHOLOGY, MULTIDISCIPLINARY",2024,41,TRUE,TRUE,TRUE
0305-0009,10.1017/s0305000919000655,ROWE; SNOW,2020,"Analyzing input quality along three dimensions: interactive, linguistic, and conceptual",Journal of Child Language,https://doi.org/10.1017/s0305000919000655,194,462,"PSYCHOLOGY, DEVELOPMENTAL",2020,38.8,TRUE,TRUE,TRUE
1557-1874,10.1007/s11469-020-00343-8,Broche-Pérez; Fernández-Fleites; Jiménez-Puig; Fernández-Castillo; Rodríguez-Martin,2022,Gender and Fear of COVID-19 in a Cuban Population Sample,International Journal of Mental Health and Addiction,https://doi.org/10.1007/s11469-020-00343-8,137,131,"PSYCHOLOGY, CLINICAL",2022,45.67,TRUE,TRUE,TRUE
2152-2715,10.1089/cyber.2014.0560,Lup; Trub; Rosenthal,2015,"Instagram #Instasad?: Exploring Associations Among Instagram Use, Depressive Symptoms, Negative Social Comparison, and Strangers Followed","Cyberpsychology, Behavior, and Social Networking",https://doi.org/10.1089/cyber.2014.0560,324,65,"PSYCHOLOGY, SOCIAL",2015,32.4,TRUE,TRUE,TRUE
0004-0002,10.1007/s10508-019-01533-9,Newcomb; Hill; Buehler; Ryan; Whitton; Mustanski,2020,"High Burden of Mental Health Problems, Substance Use, Violence, and Related Psychosocial Factors in Transgender, Non-Binary, and Gender Diverse Youth and Young Adults",Archives of Sexual Behavior,https://doi.org/10.1007/s10508-019-01533-9,249,174,"PSYCHOLOGY, CLINICAL",2020,49.8,TRUE,TRUE,TRUE
1389-0417,10.1016/j.cogsys.2019.09.007,Saba; Sameh Mohamed; El-Affendi; Amin; Sharif,2020,Brain tumor detection using fusion of hand crafted and deep learning features,Cognitive Systems Research,https://doi.org/10.1016/j.cogsys.2019.09.007,311,344,"PSYCHOLOGY, EXPERIMENTAL",2020,62.2,TRUE,TRUE,TRUE
2397-3374,10.1038/s41562-021-01056-1,Loomba; de Figueiredo; Piatek; de Graaf; Larson,2021,Measuring the impact of COVID-19 vaccine misinformation on vaccination intent in the UK and USA,Nature Human Behaviour,https://doi.org/10.1038/s41562-021-01056-1,1131,1,"PSYCHOLOGY, EXPERIMENTAL",2021,282.75,TRUE,TRUE,TRUE
0021-9630,10.1111/jcpp.13505,Russell; Stapley; Newlove‐Delgado; Salmon; White; Warren; Pearson; Ford,2022,Time trends in autism diagnosis over 20 years: a UK population‐based cohort study,Journal of Child Psychology and Psychiatry,https://doi.org/10.1111/jcpp.13505,136,19,PSYCHOLOGY,2022,45.33,TRUE,TRUE,TRUE
2397-3374,10.1038/s41562-021-01161-1,Siddiqi; Schaper; Horn; Hsu; Padmanabhan; Brodtmann; Cash; Corbetta; Choi; Dougherty; Egorova; Fitzgerald; George; Gozzi; Irmen; Kuhn; Johnson; Naidech; Pascual-Leone; Phan; Rouhl; Taylor; Voss; Zalesky; Grafman; Mayberg; Fox,2021,Brain stimulation and brain lesions converge on common causal circuits in neuropsychiatric disease,Nature Human Behaviour,https://doi.org/10.1038/s41562-021-01161-1,157,1,"PSYCHOLOGY, EXPERIMENTAL",2021,39.25,TRUE,TRUE,TRUE
0005-7967,10.1016/j.brat.2016.08.012,Fairburn; Patel,2017,The impact of digital technology on psychological treatments and their dissemination,Behaviour Research and Therapy,https://doi.org/10.1016/j.brat.2016.08.012,325,64,"PSYCHOLOGY, CLINICAL",2017,40.63,TRUE,TRUE,TRUE
0145-2134,10.1016/j.chiabu.2018.09.018,Peterson; Florence; Klevens,2018,"The economic burden of child maltreatment in the United States, 2015",Child Abuse &amp; Neglect,https://doi.org/10.1016/j.chiabu.2018.09.018,258,110,"PSYCHOLOGY, SOCIAL",2018,36.86,TRUE,TRUE,TRUE
1939-1315,10.1037/pspp0000358,Orth; Clark; Donnellan; Robins,2021,Testing prospective effects in longitudinal research: Comparing seven competing cross-lagged models.,Journal of Personality and Social Psychology,https://doi.org/10.1037/pspp0000358,378,20,"PSYCHOLOGY, SOCIAL",2021,94.5,TRUE,TRUE,TRUE
1939-1315,10.1037/pspp0000448,Pekrun; Marsh; Elliot; Stockinger; Perry; Vogl; Goetz; van Tilburg; Lüdtke; Vispoel,2023,A three-dimensional taxonomy of achievement emotions.,Journal of Personality and Social Psychology,https://doi.org/10.1037/pspp0000448,103,20,"PSYCHOLOGY, SOCIAL",2023,51.5,TRUE,TRUE,TRUE
1054-139X,10.1016/j.jadohealth.2020.05.006,Barney; Buckelew; Mesheriakova; Raymond-Flesch,2020,The COVID-19 Pandemic and Rapid Implementation of Adolescent and Young Adult Telemedicine: Challenges and Opportunities for Innovation,Journal of Adolescent Health,https://doi.org/10.1016/j.jadohealth.2020.05.006,302,30,"PSYCHOLOGY, DEVELOPMENTAL",2020,60.4,TRUE,TRUE,TRUE
1018-8827,10.1007/s00787-021-01744-3,Cost; Crosbie; Anagnostou; Birken; Charach; Monga; Kelley; Nicolson; Maguire; Burton; Schachar; Arnold; Korczak,2022,"Mostly worse, occasionally better: impact of COVID-19 pandemic on the mental health of Canadian children and adolescents",European Child &amp; Adolescent Psychiatry,https://doi.org/10.1007/s00787-021-01744-3,250,24,"PSYCHOLOGY, DEVELOPMENTAL",2022,83.33,TRUE,TRUE,TRUE
0033-2917,10.1017/s0033291714002165,Verhulst; Neale; Kendler,2015,The heritability of alcohol use disorders: a meta-analysis of twin and adoption studies,Psychological Medicine,https://doi.org/10.1017/s0033291714002165,470,26,PSYCHOLOGY,2015,47,TRUE,TRUE,TRUE
1662-5161,10.3389/fnhum.2018.00014,Lazarou; Nikolopoulos; Petrantonakis; Kompatsiaris; Tsolaki,2018,EEG-Based Brain–Computer Interfaces for Communication and Rehabilitation of People with Motor Impairment: A Novel Approach of the 21st Century,Frontiers in Human Neuroscience,https://doi.org/10.3389/fnhum.2018.00014,210,282,PSYCHOLOGY,2018,30,TRUE,TRUE,TRUE
1057-7408,10.1002/jcpy.1356,Hadi; Melumad; Park,2024,The Metaverse: A new digital frontier for consumer behavior,Journal of Consumer Psychology,https://doi.org/10.1002/jcpy.1356,131,73,"PSYCHOLOGY, APPLIED",2024,131,TRUE,TRUE,TRUE
1532-5024,10.1080/15325024.2022.2084838,Kurapov; Pavlenko; Drozdov; Bezliudna; Reznik; Isralowitz,2023,Toward an Understanding of the Russian-Ukrainian War Impact on University Students and Personnel,Journal of Loss and Trauma,https://doi.org/10.1080/15325024.2022.2084838,110,248,"PSYCHOLOGY, SOCIAL",2023,55,TRUE,TRUE,TRUE
0963-8237,10.1080/09638237.2020.1757052,Kumar; Nayar,2021,COVID 19 and its mental health consequences,Journal of Mental Health,https://doi.org/10.1080/09638237.2020.1757052,499,189,"PSYCHOLOGY, CLINICAL",2021,124.75,TRUE,TRUE,TRUE
1930-7810,10.1037/hea0000305,Klasnja; Hekler; Shiffman; Boruvka; Almirall; Tewari; Murphy,2015,Microrandomized trials: An experimental design for developing just-in-time adaptive interventions.,Health Psychology,https://doi.org/10.1037/hea0000305,444,150,PSYCHOLOGY,2015,44.4,TRUE,TRUE,TRUE
0747-5632,10.1016/j.chb.2021.106919,Sharma; Dwivedi; Arya; Siddiqui,2021,Does SMS advertising still have relevance to increase consumer purchase intention? A hybrid PLS-SEM-neural network modelling approach,Computers in Human Behavior,https://doi.org/10.1016/j.chb.2021.106919,120,12,"PSYCHOLOGY, EXPERIMENTAL",2021,30,TRUE,TRUE,TRUE
1018-8827,10.1007/s00787-020-01631-3,Di Giorgio; Di Riso; Mioni; Cellini,2021,The interplay between mothers’ and children behavioral and psychological factors during COVID-19: an Italian study,European Child &amp; Adolescent Psychiatry,https://doi.org/10.1007/s00787-020-01631-3,137,24,"PSYCHOLOGY, DEVELOPMENTAL",2021,34.25,TRUE,TRUE,TRUE
2167-7026,10.1177/2167702617745092,Fried; Eidhof; Palic; Costantini; Huisman-van Dijk; Bockting; Engelhard; Armour; Nielsen; Karstoft,2018,Replicability and Generalizability of Posttraumatic Stress Disorder (PTSD) Networks: A Cross-Cultural Multisite Study of PTSD Symptoms in Four Trauma Patient Samples,Clinical Psychological Science,https://doi.org/10.1177/2167702617745092,301,47,PSYCHOLOGY,2018,43,TRUE,TRUE,TRUE
1751-9004,10.1111/spc3.12267,Goh; Hall; Rosenthal,2016,Mini Meta‐Analysis of Your Own Studies: Some Arguments on Why and a Primer on How,Social and Personality Psychology Compass,https://doi.org/10.1111/spc3.12267,645,48,"PSYCHOLOGY, SOCIAL",2016,71.67,TRUE,TRUE,TRUE
0747-5632,10.1016/j.chb.2019.07.002,McLean; Wilson,2019,Shopping in the digital world: Examining customer engagement through augmented reality mobile applications,Computers in Human Behavior,https://doi.org/10.1016/j.chb.2019.07.002,357,12,"PSYCHOLOGY, EXPERIMENTAL",2019,59.5,TRUE,TRUE,TRUE
0021-9762,10.1002/jclp.23064,Twenge; Joiner,2020,Mental distress among U.S. adults during the COVID‐19 pandemic,Journal of Clinical Psychology,https://doi.org/10.1002/jclp.23064,215,257,"PSYCHOLOGY, CLINICAL",2020,43,TRUE,TRUE,TRUE
0031-5826,10.1111/peps.12140,Wang; Holmes; Oh; Zhu,2016,Do CEOs Matter to Firm Strategic Actions and Firm Performance? A Meta‐Analytic Investigation Based on Upper Echelons Theory,Personnel Psychology,https://doi.org/10.1111/peps.12140,305,52,"PSYCHOLOGY, APPLIED",2016,33.89,TRUE,TRUE,TRUE
0140-1971,10.1016/j.adolescence.2018.06.001,Crowley; Wolfson; Tarokh; Carskadon,2018,An update on adolescent sleep: New evidence informing the perfect storm model☆,Journal of Adolescence,https://doi.org/10.1016/j.adolescence.2018.06.001,379,167,"PSYCHOLOGY, DEVELOPMENTAL",2018,54.14,TRUE,TRUE,TRUE
2689-5269,10.1080/26895269.2022.2100644,Coleman; Radix; Bouman; Brown; de Vries; Deutsch; Ettner; Fraser; Goodman; Green; Hancock; Johnson; Karasic; Knudson; Leibowitz; Meyer-Bahlburg; Monstrey; Motmans; Nahata; Nieder; Reisner; Richards; Schechter; Tangpricha; Tishelman; Van Trotsenburg; Winter; Ducheny; Adams; Adrián; Allen; Azul; Bagga; Başar; Bathory; Belinky; Berg; Berli; Bluebond-Langner; Bouman; Bowers; Brassard; Byrne; Capitán; Cargill; Carswell; Chang; Chelvakumar; Corneil; Dalke; De Cuypere; de Vries; Den Heijer; Devor; Dhejne; D’Marco; Edmiston; Edwards-Leeper; Ehrbar; Ehrensaft; Eisfeld; Elaut; Erickson-Schroth; Feldman; Fisher; Garcia; Gijs; Green; Hall; Hardy; Irwig; Jacobs; Janssen; Johnson; Klink; Kreukels; Kuper; Kvach; Malouf; Massey; Mazur; McLachlan; Morrison; Mosser; Neira; Nygren; Oates; Obedin-Maliver; Pagkalos; Patton; Phanuphak; Rachlin; Reed; Rider; Ristori; Robbins-Cherry; Roberts; Rodriguez-Wallberg; Rosenthal; Sabir; Safer; Scheim; Seal; Sehoole; Spencer; St. Amand; Steensma; Strang; Taylor; Tilleman; T’Sjoen; Vala; Van Mello; Veale; Vencill; Vincent; Wesp; West; Arcelus,2022,"Standards of Care for the Health of Transgender and Gender Diverse People, Version 8",International Journal of Transgender Health,https://doi.org/10.1080/26895269.2022.2100644,1104,5,"PSYCHOLOGY, CLINICAL",2022,368,TRUE,TRUE,TRUE
0021-9630,10.1111/jcpp.12573,Norbury; Gooch; Wray; Baird; Charman; Simonoff; Vamvakas; Pickles,2016,The impact of nonverbal ability on prevalence and clinical presentation of language disorder: evidence from a population study,Journal of Child Psychology and Psychiatry,https://doi.org/10.1111/jcpp.12573,622,19,PSYCHOLOGY,2016,69.11,TRUE,TRUE,TRUE
0013-1644,10.1177/00131644211003261,Sim; Kim; Suh,2022,Sample Size Requirements for Simple and Complex Mediation Models,Educational and Psychological Measurement,https://doi.org/10.1177/00131644211003261,103,345,"PSYCHOLOGY, EDUCATIONAL",2022,34.33,TRUE,TRUE,TRUE
0022-3891,10.1080/00223891.2018.1530680,van Ginkel; Linting; Rippe; van der Voort,2020,Rebutting Existing Misconceptions About Multiple Imputation as a Method for Handling Missing Data,Journal of Personality Assessment,https://doi.org/10.1080/00223891.2018.1530680,322,200,"PSYCHOLOGY, CLINICAL",2020,64.4,TRUE,TRUE,TRUE
0890-8567,10.1016/j.jaac.2017.06.012,Álvarez-Bueno; Pesce; Cavero-Redondo; Sánchez-López; Martínez-Hortelano; Martínez-Vizcaíno,2017,The Effect of Physical Activity Interventions on Children’s Cognition and Metacognition: A Systematic Review and Meta-Analysis,Journal of the American Academy of Child &amp; Adolescent Psychiatry,https://doi.org/10.1016/j.jaac.2017.06.012,304,10,"PSYCHOLOGY, DEVELOPMENTAL",2017,38,TRUE,TRUE,TRUE
1939-1463,10.1037/met0000423,Jobst; Bader; Moshagen,2023,A tutorial on assessing statistical power and determining sample size for structural equation models.,Psychological Methods,https://doi.org/10.1037/met0000423,91,17,"PSYCHOLOGY, MULTIDISCIPLINARY",2023,45.5,TRUE,TRUE,TRUE
1939-2176,10.1037/edu0000187,Jennings; Brown; Frank; Doyle; Oh; Davis; Rasheed; DeWeese; DeMauro; Cham; Greenberg,2017,Impacts of the CARE for Teachers program on teachers’ social and emotional competence and classroom interactions.,Journal of Educational Psychology,https://doi.org/10.1037/edu0000187,337,28,"PSYCHOLOGY, EDUCATIONAL",2017,42.13,TRUE,TRUE,TRUE
1362-3613,10.1177/1362361319829628,Kapp; Steward; Crane; Elliott; Elphick; Pellicano; Russell,2019,‘People should be allowed to do what they like’: Autistic adults’ views and experiences of stimming,Autism,https://doi.org/10.1177/1362361319829628,271,37,"PSYCHOLOGY, DEVELOPMENTAL",2019,45.17,TRUE,TRUE,TRUE
1664-1078,10.3389/fpsyg.2018.00758,Roskam; Brianda; Mikolajczak,2018,A Step Forward in the Conceptualization and Measurement of Parental Burnout: The Parental Burnout Assessment (PBA),Frontiers in Psychology,https://doi.org/10.3389/fpsyg.2018.00758,245,228,"PSYCHOLOGY, MULTIDISCIPLINARY",2018,35,TRUE,TRUE,TRUE
0004-0002,10.1007/s10508-018-1248-x,Grubbs; Perry; Wilt; Reid,2019,Pornography Problems Due to Moral Incongruence: An Integrative Model with a Systematic Review and Meta-Analysis,Archives of Sexual Behavior,https://doi.org/10.1007/s10508-018-1248-x,210,174,"PSYCHOLOGY, CLINICAL",2019,35,TRUE,TRUE,TRUE
1071-5819,10.1016/j.ijhcs.2018.01.004,O’Brien; Cairns; Hall,2018,A practical approach to measuring user engagement with the refined user engagement scale (UES) and new UES short form,International Journal of Human-Computer Studies,https://doi.org/10.1016/j.ijhcs.2018.01.004,531,33,"PSYCHOLOGY, MULTIDISCIPLINARY",2018,75.86,TRUE,TRUE,TRUE
0747-5632,10.1016/j.chb.2020.106327,Lim; Choe; Zhang; Noh,2020,"The role of wishful identification, emotional engagement, and parasocial relationships in repeated viewing of live-streaming games: A social cognitive theory perspective",Computers in Human Behavior,https://doi.org/10.1016/j.chb.2020.106327,214,12,"PSYCHOLOGY, EXPERIMENTAL",2020,42.8,TRUE,TRUE,TRUE
2397-3374,10.1038/s41562-020-0906-x,Habersaat; Betsch; Danchin; Sunstein; Böhm; Falk; Brewer; Omer; Scherzer; Sah; Fischer; Scheel; Fancourt; Kitayama; Dubé; Leask; Dutta; MacDonald; Temkina; Lieberoth; Jackson; Lewandowsky; Seale; Fietje; Schmid; Gelfand; Korn; Eitze; Felgendreff; Sprengholz; Salvi; Butler,2020,Ten considerations for effectively managing the COVID-19 transition,Nature Human Behaviour,https://doi.org/10.1038/s41562-020-0906-x,237,1,"PSYCHOLOGY, EXPERIMENTAL",2020,47.4,TRUE,TRUE,TRUE
0014-0139,10.1080/00140139.2015.1081988,de Looze; Bosch; Krause; Stadler; O’Sullivan,2016,Exoskeletons for industrial application and their potential effects on physical work load,Ergonomics,https://doi.org/10.1080/00140139.2015.1081988,676,362,PSYCHOLOGY,2016,75.11,TRUE,TRUE,TRUE
1664-1078,10.3389/fpsyg.2015.01093,Kuo,2015,How might contact with nature promote human health? Promising mechanisms and a possible central pathway,Frontiers in Psychology,https://doi.org/10.3389/fpsyg.2015.01093,406,228,"PSYCHOLOGY, MULTIDISCIPLINARY",2015,40.6,TRUE,TRUE,TRUE
1381-2890,10.1007/s11218-022-09686-7,Carroll; Forrest; Sanders-O’Connor; Flynn; Bower; Fynes-Clinton; York; Ziaei,2022,Teacher stress and burnout in Australia: examining the role of intrapersonal and environmental factors,Social Psychology of Education,https://doi.org/10.1007/s11218-022-09686-7,107,138,"PSYCHOLOGY, EDUCATIONAL",2022,35.67,TRUE,TRUE,TRUE
0033-2917,10.1017/s0033291720004067,Salali; Uysal,2022,COVID-19 vaccine hesitancy is associated with beliefs on the origin of the novel coronavirus in the UK and Turkey,Psychological Medicine,https://doi.org/10.1017/s0033291720004067,240,26,PSYCHOLOGY,2022,80,TRUE,TRUE,TRUE
0022-1678,10.1177/0022167817709585,Watts; Day; Krzanowski; Nutt; Carhart-Harris,2017,Patients’ Accounts of Increased “Connectedness” and “Acceptance” After Psilocybin for Treatment-Resistant Depression,Journal of Humanistic Psychology,https://doi.org/10.1177/0022167817709585,331,556,"PSYCHOLOGY, MULTIDISCIPLINARY",2017,41.38,TRUE,TRUE,TRUE
1664-1078,10.3389/fpsyg.2017.00220,Guendelman; Medeiros; Rampes,2017,"Mindfulness and Emotion Regulation: Insights from Neurobiological, Psychological, and Clinical Studies",Frontiers in Psychology,https://doi.org/10.3389/fpsyg.2017.00220,303,228,"PSYCHOLOGY, MULTIDISCIPLINARY",2017,37.88,TRUE,TRUE,TRUE
2662-2041,10.1007/s42761-022-00163-0,Park; Kubzansky; Chafouleas; Davidson; Keltner; Parsafar; Conwell; Martin; Hanmer; Wang,2023,Emotional Well-Being: What It Is and Why It Matters,Affective Science,https://doi.org/10.1007/s42761-022-00163-0,74,353,PSYCHOLOGY,2023,37,TRUE,TRUE,TRUE
1046-1310,10.1007/s12144-020-01260-8,Löffler; Greitemeyer,2023,Are women the more empathetic gender? The effects of gender role expectations,Current Psychology,https://doi.org/10.1007/s12144-020-01260-8,70,250,"PSYCHOLOGY, MULTIDISCIPLINARY",2023,35,TRUE,TRUE,TRUE
1018-8827,10.1007/s00787-021-01889-1,Ravens-Sieberer; Kaman; Erhart; Otto; Devine; Löffler; Hurrelmann; Bullinger; Barkmann; Siegel; Simon; Wieler; Schlack; Hölling,2023,Quality of life and mental health in children and adolescents during the first year of the COVID-19 pandemic: results of a two-wave nationwide population-based study,European Child &amp; Adolescent Psychiatry,https://doi.org/10.1007/s00787-021-01889-1,160,24,"PSYCHOLOGY, DEVELOPMENTAL",2023,80,TRUE,TRUE,TRUE
1939-2176,10.1037/edu0000133,Gajda; Karwowski; Beghetto,2017,Creativity and academic achievement: A meta-analysis.,Journal of Educational Psychology,https://doi.org/10.1037/edu0000133,277,28,"PSYCHOLOGY, EDUCATIONAL",2017,34.63,TRUE,TRUE,TRUE
0747-5632,10.1016/j.chb.2020.106568,Wang; Hao; Platt,2021,Examining risk and crisis communications of government agencies and stakeholders during early-stages of COVID-19 on Twitter,Computers in Human Behavior,https://doi.org/10.1016/j.chb.2020.106568,158,12,"PSYCHOLOGY, EXPERIMENTAL",2021,39.5,TRUE,TRUE,TRUE
0021-9630,10.1111/jcpp.13106,Glenn; Kleiman; Kellerman; Pollak; Cha; Esposito; Porter; Wyman; Boatman,2020,Annual Research Review: A meta‐analytic review of worldwide suicide rates in adolescents,Journal of Child Psychology and Psychiatry,https://doi.org/10.1111/jcpp.13106,200,19,PSYCHOLOGY,2020,40,TRUE,TRUE,TRUE
1046-1310,10.1007/s12144-022-03182-z,Brailovskaia; Margraf,2024,Addictive social media use during Covid-19 outbreak: Validation of the Bergen Social Media Addiction Scale (BSMAS) and investigation of protective factors in nine countries,Current Psychology,https://doi.org/10.1007/s12144-022-03182-z,30,250,"PSYCHOLOGY, MULTIDISCIPLINARY",2024,30,TRUE,TRUE,TRUE
1061-5806,10.1080/10615806.2016.1275585,Crum; Akinola; Martin; Fath,2017,"The role of stress mindset in shaping cognitive, emotional, and physiological responses to challenging and threatening stress","Anxiety, Stress, &amp; Coping",https://doi.org/10.1080/10615806.2016.1275585,244,294,"PSYCHOLOGY, MULTIDISCIPLINARY",2017,30.5,TRUE,TRUE,TRUE
1046-1310,10.1007/s12144-023-04275-z,Sparks; Zidenberg; Olver,2024,"One is the loneliest number: Involuntary celibacy (incel), mental health, and loneliness",Current Psychology,https://doi.org/10.1007/s12144-023-04275-z,30,250,"PSYCHOLOGY, MULTIDISCIPLINARY",2024,30,TRUE,TRUE,TRUE
1064-0266,10.1080/10640266.2020.1790271,Cooper; Reilly; Siegel; Coniglio; Sadeh-Sharvit; Pisetsky; Anderson,2022,Eating disorders during the COVID-19 pandemic and quarantine: an overview of risks and recommendations for treatment and early intervention,Eating Disorders,https://doi.org/10.1080/10640266.2020.1790271,105,171,PSYCHOLOGY,2022,35,TRUE,TRUE,TRUE
