ISSN,DOI,authors,year,title,journal,URL,citations,impact_factor_rank,category,year_for_citations_by_year,citations_per_year,more_than_20_citations_per_year,more_than_25_citations_per_year,more_than_30_citations_per_year
0301-0511,10.1016/j.biopsycho.2015.12.003,Garfinkel; Tiley; O'Keeffe; Harrison; Seth; Critchley,2016,Discrepancies between dimensions of interoception in autism: Implications for emotion and anxiety,Biological Psychology,https://doi.org/10.1016/j.biopsycho.2015.12.003,318,199,PSYCHOLOGY,2016,35.33,TRUE,TRUE,TRUE
0956-7976,10.1177/0956797620939054,Pennycook; McPhetres; Zhang; Lu; Rand,2020,Fighting COVID-19 Misinformation on Social Media: Experimental Evidence for a Scalable Accuracy-Nudge Intervention,Psychological Science,https://doi.org/10.1177/0956797620939054,994,44,"PSYCHOLOGY, MULTIDISCIPLINARY",2020,198.8,TRUE,TRUE,TRUE
1664-1078,10.3389/fpsyg.2016.00508,Dowker; Sarkar; Looi,2016,Mathematics Anxiety: What Have We Learned in 60 Years?,Frontiers in Psychology,https://doi.org/10.3389/fpsyg.2016.00508,413,228,"PSYCHOLOGY, MULTIDISCIPLINARY",2016,45.89,TRUE,TRUE,TRUE
0737-0008,10.1080/07370008.2016.1181879,Bang; Vossoughi,2016,Participatory Design Research and Educational Justice: Studying Learning and Relations Within Social Change Making,Cognition and Instruction,https://doi.org/10.1080/07370008.2016.1181879,327,286,"PSYCHOLOGY, EDUCATIONAL",2016,36.33,TRUE,TRUE,TRUE
0956-7976,10.1177/0956797620964422,Pfattheicher; Nockur; Böhm; Sassenrath; Petersen,2020,The Emotional Path to Action: Empathy Promotes Physical Distancing and Wearing of Face Masks During the COVID-19 Pandemic,Psychological Science,https://doi.org/10.1177/0956797620964422,344,44,"PSYCHOLOGY, MULTIDISCIPLINARY",2020,68.8,TRUE,TRUE,TRUE
1138-7416,10.1017/sjp.2021.46,Igartua; Hayes,2021,"Mediation, Moderation, and Conditional Process Analysis: Concepts, Computations, and Some Common Confusions",The Spanish Journal of Psychology,https://doi.org/10.1017/sjp.2021.46,252,191,PSYCHOLOGY,2021,63,TRUE,TRUE,TRUE
2397-3374,10.1038/s41562-021-01146-0,Cadario; Longoni; Morewedge,2021,"Understanding, explaining, and utilizing medical artificial intelligence",Nature Human Behaviour,https://doi.org/10.1038/s41562-021-01146-0,158,1,"PSYCHOLOGY, EXPERIMENTAL",2021,39.5,TRUE,TRUE,TRUE
1077-7229,10.1016/j.cbpra.2014.01.010,Scott; Lewis,2015,Using Measurement-Based Care to Enhance Any Treatment,Cognitive and Behavioral Practice,https://doi.org/10.1016/j.cbpra.2014.01.010,311,185,"PSYCHOLOGY, CLINICAL",2015,31.1,TRUE,TRUE,TRUE
1061-5806,10.1080/10615806.2020.1797695,Bakker; de Vries,2021,Job Demands–Resources theory and self-regulation: new explanations and remedies for job burnout,"Anxiety, Stress, &amp; Coping",https://doi.org/10.1080/10615806.2020.1797695,460,294,"PSYCHOLOGY, MULTIDISCIPLINARY",2021,115,TRUE,TRUE,TRUE
1532-5024,10.1080/15325024.2020.1765098,Trzebiński; Cabański; Czarnecka,2020,"Reaction to the COVID-19 Pandemic: The Influence of Meaning in Life, Life Satisfaction, and Assumptions on World Orderliness and Positivity",Journal of Loss and Trauma,https://doi.org/10.1080/15325024.2020.1765098,232,248,"PSYCHOLOGY, SOCIAL",2020,46.4,TRUE,TRUE,TRUE
0033-2917,10.1017/s0033291719003155,Freeman; Loe; Kingdon; Startup; Molodynski; Rosebrock; Brown; Sheaves; Waite; Bird,2021,"The revised Green et al., Paranoid Thoughts Scale (R-GPTS): psychometric properties, severity ranges, and clinical cut-offs",Psychological Medicine,https://doi.org/10.1017/s0033291719003155,151,26,PSYCHOLOGY,2021,37.75,TRUE,TRUE,TRUE
2397-3374,10.1038/s41562-021-01087-8,Parolin; Lee,2021,"Large socio-economic, geographic and demographic disparities exist in exposure to school closures",Nature Human Behaviour,https://doi.org/10.1038/s41562-021-01087-8,128,1,"PSYCHOLOGY, EXPERIMENTAL",2021,32,TRUE,TRUE,TRUE
1071-5819,10.1016/j.ijhcs.2019.102370,Abeele; Spiel; Nacke; Johnson; Gerling,2020,Development and validation of the player experience inventory: A scale to measure player experiences at the level of functional and psychosocial consequences,International Journal of Human-Computer Studies,https://doi.org/10.1016/j.ijhcs.2019.102370,196,33,"PSYCHOLOGY, MULTIDISCIPLINARY",2020,39.2,TRUE,TRUE,TRUE
1179-1578,10.2147/prbm.s178240,Galvez-Sánchez; Duschek; Reyes del Paso,2019,&lt;p&gt;Psychological impact of fibromyalgia: current perspectives&lt;/p&gt;,Psychology Research and Behavior Management,https://doi.org/10.2147/prbm.s178240,212,194,"PSYCHOLOGY, CLINICAL",2019,35.33,TRUE,TRUE,TRUE
1057-7408,10.1016/j.jcps.2014.08.002,Chernev; Böckenholt; Goodman,2015,Choice overload: A conceptual review and meta‐analysis,Journal of Consumer Psychology,https://doi.org/10.1016/j.jcps.2014.08.002,494,73,"PSYCHOLOGY, APPLIED",2015,49.4,TRUE,TRUE,TRUE
0890-8567,10.1016/j.jaac.2020.07.895,Copeland; Alaie; Jonsson; Shanahan,2021,Associations of Childhood and Adolescent Depression With Adult Psychiatric and Functional Outcomes,Journal of the American Academy of Child &amp; Adolescent Psychiatry,https://doi.org/10.1016/j.jaac.2020.07.895,136,10,"PSYCHOLOGY, DEVELOPMENTAL",2021,34,TRUE,TRUE,TRUE
1359-1045,10.1177/1359104518775154,O’Reilly; Dogra; Whiteman; Hughes; Eruyar; Reilly,2018,Is social media bad for mental health and wellbeing? Exploring the perspectives of adolescents,Clinical Child Psychology and Psychiatry,https://doi.org/10.1177/1359104518775154,216,457,PSYCHOLOGY,2018,30.86,TRUE,TRUE,TRUE
2152-2715,10.1089/cyber.2015.0157,Lee; Lee; Moon; Sung,2015,Pictures Speak Louder than Words: Motivations for Using Instagram,"Cyberpsychology, Behavior, and Social Networking",https://doi.org/10.1089/cyber.2015.0157,333,65,"PSYCHOLOGY, SOCIAL",2015,33.3,TRUE,TRUE,TRUE
0306-4603,10.1016/j.addbeh.2020.106527,Lechner; Laurene; Patel; Anderson; Grega; Kenne,2020,Changes in alcohol use as a function of psychological distress and social support following COVID-19 related University closings,Addictive Behaviors,https://doi.org/10.1016/j.addbeh.2020.106527,249,90,"PSYCHOLOGY, CLINICAL",2020,49.8,TRUE,TRUE,TRUE
0022-1031,10.1016/j.jesp.2019.103947,Hornsey; Finlayson; Chatwood; Begeny,2020,"Donald Trump and vaccination: The effect of political identity, conspiracist ideation and presidential tweets on vaccine hesitancy",Journal of Experimental Social Psychology,https://doi.org/10.1016/j.jesp.2019.103947,194,140,"PSYCHOLOGY, SOCIAL",2020,38.8,TRUE,TRUE,TRUE
0887-6185,10.1016/j.janxdis.2020.102239,Jungmann; Witthöft,2020,"Health anxiety, cyberchondria, and coping in the current COVID-19 pandemic: Which factors are related to coronavirus anxiety?",Journal of Anxiety Disorders,https://doi.org/10.1016/j.janxdis.2020.102239,429,45,"PSYCHOLOGY, CLINICAL",2020,85.8,TRUE,TRUE,TRUE
1079-5014,10.1093/geronb/gbaa074,Bruine de Bruin,2021,Age Differences in COVID-19 Risk Perceptions and Mental Health: Evidence From a National U.S. Survey Conducted in March 2020,The Journals of Gerontology: Series B,https://doi.org/10.1093/geronb/gbaa074,326,46,PSYCHOLOGY,2021,81.5,TRUE,TRUE,TRUE
0003-6870,10.1016/j.apergo.2017.07.006,Körber; Baseler; Bengler,2018,Introduction matters: Manipulating trust in automation and reliance in automated driving,Applied Ergonomics,https://doi.org/10.1016/j.apergo.2017.07.006,276,155,"PSYCHOLOGY, APPLIED",2018,39.43,TRUE,TRUE,TRUE
0890-8567,10.1016/j.jaac.2014.12.010,Cortese; Ferrin; Brandeis; Buitelaar; Daley; Dittmann; Holtmann; Santosh; Stevenson; Stringaris; Zuddas; Sonuga-Barke,2015,Cognitive Training for Attention-Deficit/Hyperactivity Disorder: Meta-Analysis of Clinical and Neuropsychological Outcomes From Randomized Controlled Trials,Journal of the American Academy of Child &amp; Adolescent Psychiatry,https://doi.org/10.1016/j.jaac.2014.12.010,386,10,"PSYCHOLOGY, DEVELOPMENTAL",2015,38.6,TRUE,TRUE,TRUE
1046-1310,10.1007/s12144-022-02738-3,Navarro; Tudge,2023,Technologizing Bronfenbrenner: Neo-ecological Theory,Current Psychology,https://doi.org/10.1007/s12144-022-02738-3,79,250,"PSYCHOLOGY, MULTIDISCIPLINARY",2023,39.5,TRUE,TRUE,TRUE
0033-2917,10.1017/s0033291718003823,Angelakis; Gillespie; Panagioti,2019,Childhood maltreatment and adult suicidality: a comprehensive systematic review with meta-analysis,Psychological Medicine,https://doi.org/10.1017/s0033291718003823,238,26,PSYCHOLOGY,2019,39.67,TRUE,TRUE,TRUE
1094-4281,10.1177/1094428114560023,Simmering; Fuller; Richardson; Ocal; Atinc,2015,"Marker Variable Choice, Reporting, and Interpretation in the Detection of Common Method Variance",Organizational Research Methods,https://doi.org/10.1177/1094428114560023,470,13,"PSYCHOLOGY, APPLIED",2015,47,TRUE,TRUE,TRUE
1939-2176,10.1037/edu0000228,Frenzel; Becker-Kurz; Pekrun; Goetz; Lüdtke,2018,Emotion transmission in the classroom revisited: A reciprocal effects model of teacher and student enjoyment.,Journal of Educational Psychology,https://doi.org/10.1037/edu0000228,225,28,"PSYCHOLOGY, EDUCATIONAL",2018,32.14,TRUE,TRUE,TRUE
1088-8438,10.1080/10888438.2017.1291643,Kim,2017,Why the Simple View of Reading Is Not Simplistic: Unpacking Component Skills of Reading Using a Direct and Indirect Effect Model of Reading (DIER),Scientific Studies of Reading,https://doi.org/10.1080/10888438.2017.1291643,245,175,"PSYCHOLOGY, EDUCATIONAL",2017,30.63,TRUE,TRUE,TRUE
1359-1053,10.1177/1359105317695429,Estacio; Whittle; Protheroe,2019,"The digital divide: Examining socio-demographic factors associated with health literacy, access and use of internet to seek health information",Journal of Health Psychology,https://doi.org/10.1177/1359105317695429,194,254,"PSYCHOLOGY, CLINICAL",2019,32.33,TRUE,TRUE,TRUE
0956-7976,10.1177/0956797618774253,Ritchie; Tucker-Drob,2018,How Much Does Education Improve Intelligence? A Meta-Analysis,Psychological Science,https://doi.org/10.1177/0956797618774253,391,44,"PSYCHOLOGY, MULTIDISCIPLINARY",2018,55.86,TRUE,TRUE,TRUE
0361-476X,10.1016/j.cedpsych.2019.101832,Schunk; DiBenedetto,2020,Motivation and social cognitive theory,Contemporary Educational Psychology,https://doi.org/10.1016/j.cedpsych.2019.101832,546,76,"PSYCHOLOGY, EDUCATIONAL",2020,109.2,TRUE,TRUE,TRUE
2397-3374,10.1038/s41562-021-01117-5,Parry; Davidson; Sewall; Fisher; Mieczkowski; Quintana,2021,A systematic review and meta-analysis of discrepancies between logged and self-reported digital media use,Nature Human Behaviour,https://doi.org/10.1038/s41562-021-01117-5,364,1,"PSYCHOLOGY, EXPERIMENTAL",2021,91,TRUE,TRUE,TRUE
2397-3374,10.1038/s41562-021-01096-7,Josephson; Kilic; Michler,2021,Socioeconomic impacts of COVID-19 in low-income countries,Nature Human Behaviour,https://doi.org/10.1038/s41562-021-01096-7,241,1,"PSYCHOLOGY, EXPERIMENTAL",2021,60.25,TRUE,TRUE,TRUE
0162-3257,10.1007/s10803-019-03927-z,Fuller; Kaiser,2020,The Effects of Early Intervention on Social Communication Outcomes for Children with Autism Spectrum Disorder: A Meta-analysis,Journal of Autism and Developmental Disorders,https://doi.org/10.1007/s10803-019-03927-z,231,152,"PSYCHOLOGY, DEVELOPMENTAL",2020,46.2,TRUE,TRUE,TRUE
1931-390X,10.1037/aca0000420,Murray; Liang; Brosowsky; Seli,2024,What are the benefits of mind wandering to creativity?,"Psychology of Aesthetics, Creativity, and the Arts",https://doi.org/10.1037/aca0000420,31,203,"PSYCHOLOGY, EXPERIMENTAL",2024,31,TRUE,TRUE,TRUE
1939-134X,10.1037/pas0000623,Sellbom; Tellegen,2019,Factor analysis in psychological assessment research: Common pitfalls and recommendations.,Psychological Assessment,https://doi.org/10.1037/pas0000623,205,123,"PSYCHOLOGY, CLINICAL",2019,34.17,TRUE,TRUE,TRUE
1939-1854,10.1037/apl0000906,Bennett; Campion; Keeler; Keener,2021,Videoconference fatigue? Exploring changes in fatigue after videoconference meetings during COVID-19.,Journal of Applied Psychology,https://doi.org/10.1037/apl0000906,189,7,"PSYCHOLOGY, APPLIED",2021,47.25,TRUE,TRUE,TRUE
2329-0390,10.1037/sgd0000607,Matsuno; Bricker; Collazo; Mohr; Balsam,2024,“The default is just going to be getting misgendered”: Minority stress experiences among nonbinary adults.,Psychology of Sexual Orientation and Gender Diversity,https://doi.org/10.1037/sgd0000607,40,98,PSYCHOLOGY,2024,40,TRUE,TRUE,TRUE
0747-5632,10.1016/j.chb.2019.09.015,Boerman,2020,The effects of the standardized instagram disclosure for micro- and meso-influencers,Computers in Human Behavior,https://doi.org/10.1016/j.chb.2019.09.015,257,12,"PSYCHOLOGY, EXPERIMENTAL",2020,51.4,TRUE,TRUE,TRUE
1930-7810,10.1037/hea0000387,Sheeran; Maki; Montanaro; Avishai-Yitshak; Bryan; Klein; Miles; Rothman,2016,"The impact of changing attitudes, norms, and self-efficacy on health-related intentions and behavior: A meta-analysis.",Health Psychology,https://doi.org/10.1037/hea0000387,698,150,PSYCHOLOGY,2016,77.56,TRUE,TRUE,TRUE
0018-7208,10.1177/0018720816681350,Endsley,2017,From Here to Autonomy,Human Factors: The Journal of the Human Factors and Ergonomics Society,https://doi.org/10.1177/0018720816681350,488,186,PSYCHOLOGY,2017,61,TRUE,TRUE,TRUE
1750-9467,10.1016/j.rasd.2021.101759,Rong; Yang; Jin; Wang,2021,Prevalence of attention-deficit/hyperactivity disorder in individuals with autism spectrum disorder: A meta-analysis,Research in Autism Spectrum Disorders,https://doi.org/10.1016/j.rasd.2021.101759,133,311,"PSYCHOLOGY, DEVELOPMENTAL",2021,33.25,TRUE,TRUE,TRUE
1662-5161,10.3389/fnhum.2016.00601,Banakou; Hanumanthu; Slater,2016,Virtual Embodiment of White People in a Black Virtual Body Leads to a Sustained Reduction in Their Implicit Racial Bias,Frontiers in Human Neuroscience,https://doi.org/10.3389/fnhum.2016.00601,275,282,PSYCHOLOGY,2016,30.56,TRUE,TRUE,TRUE
2398-063X,10.1017/bpp.2021.12,Shahab; Lades,2024,Sludge and transaction costs,Behavioural Public Policy,https://doi.org/10.1017/bpp.2021.12,30,40,"PSYCHOLOGY, APPLIED",2024,30,TRUE,TRUE,TRUE
0890-8567,10.1016/j.jaac.2016.06.016,Erskine; Norman; Ferrari; Chan; Copeland; Whiteford; Scott,2016,Long-Term Outcomes of Attention-Deficit/Hyperactivity Disorder and Conduct Disorder: A Systematic Review and Meta-Analysis,Journal of the American Academy of Child &amp; Adolescent Psychiatry,https://doi.org/10.1016/j.jaac.2016.06.016,386,10,"PSYCHOLOGY, DEVELOPMENTAL",2016,42.89,TRUE,TRUE,TRUE
1942-969X,10.1037/tra0000866,Kofman; Garfin,2020,Home is not always a haven: The domestic violence crisis amid the COVID-19 pandemic.,"Psychological Trauma: Theory, Research, Practice, and Policy",https://doi.org/10.1037/tra0000866,212,204,"PSYCHOLOGY, CLINICAL",2020,42.4,TRUE,TRUE,TRUE
1939-1315,10.1037/pspp0000210,Damian; Spengler; Sutu; Roberts,2019,Sixteen going on sixty-six: A longitudinal study of personality stability and change across 50 years.,Journal of Personality and Social Psychology,https://doi.org/10.1037/pspp0000210,183,20,"PSYCHOLOGY, SOCIAL",2019,30.5,TRUE,TRUE,TRUE
0887-6185,10.1016/j.janxdis.2020.102289,Taylor; Landry; Rachor; Paluszek; Asmundson,2020,"Fear and avoidance of healthcare workers: An important, under-recognized form of stigmatization during the COVID-19 pandemic",Journal of Anxiety Disorders,https://doi.org/10.1016/j.janxdis.2020.102289,225,45,"PSYCHOLOGY, CLINICAL",2020,45,TRUE,TRUE,TRUE
1048-9843,10.1016/j.leaqua.2017.01.006,Antonakis,2017,On doing better science: From thrill of discovery to policy implications,The Leadership Quarterly,https://doi.org/10.1016/j.leaqua.2017.01.006,315,11,"PSYCHOLOGY, APPLIED",2017,39.38,TRUE,TRUE,TRUE
0003-6870,10.1016/j.apergo.2018.10.006,Li; Ma; Chan; Man,2019,Health monitoring through wearable technologies for older adults: Smart wearables acceptance model,Applied Ergonomics,https://doi.org/10.1016/j.apergo.2018.10.006,294,155,"PSYCHOLOGY, APPLIED",2019,49,TRUE,TRUE,TRUE
0031-9384,10.1016/j.physbeh.2014.10.033,Tomova; Husarova; Lakatosova; Bakos; Vlkova; Babinska; Ostatnikova,2015,Gastrointestinal microbiota in children with autism in Slovakia,Physiology &amp; Behavior,https://doi.org/10.1016/j.physbeh.2014.10.033,457,272,"PSYCHOLOGY, BIOLOGICAL",2015,45.7,TRUE,TRUE,TRUE
2397-3374,10.1038/s41562-020-01012-5,Druckman; Klar; Krupnikov; Levendusky; Ryan,2020,"Affective polarization, local contexts and public opinion in America",Nature Human Behaviour,https://doi.org/10.1038/s41562-020-01012-5,249,1,"PSYCHOLOGY, EXPERIMENTAL",2020,49.8,TRUE,TRUE,TRUE
0956-7976,10.1177/0956797615571017,Paunesku; Walton; Romero; Smith; Yeager; Dweck,2015,Mind-Set Interventions Are a Scalable Treatment for Academic Underachievement,Psychological Science,https://doi.org/10.1177/0956797615571017,550,44,"PSYCHOLOGY, MULTIDISCIPLINARY",2015,55,TRUE,TRUE,TRUE
0005-7967,10.1016/j.brat.2022.104155,Hayes; Ciarrochi; Hofmann; Chin; Sahdra,2022,Evolving an idionomic approach to processes of change: Towards a unified personalized science of human improvement,Behaviour Research and Therapy,https://doi.org/10.1016/j.brat.2022.104155,91,64,"PSYCHOLOGY, CLINICAL",2022,30.33,TRUE,TRUE,TRUE
0959-4752,10.1016/j.learninstruc.2018.08.002,Loderer; Pekrun; Lester,2020,Beyond cold technology: A systematic review and meta-analysis on emotions in technology-based learning environments,Learning and Instruction,https://doi.org/10.1016/j.learninstruc.2018.08.002,206,49,"PSYCHOLOGY, EDUCATIONAL",2020,41.2,TRUE,TRUE,TRUE
1937-1888,10.15288/jsad.2016.77.185,Stockwell; Zhao; Panwar; Roemer; Naimi; Chikritzhs,2016,Do “Moderate” Drinkers Have Reduced Mortality Risk? A Systematic Review and Meta-Analysis of Alcohol Consumption and All-Cause Mortality,Journal of Studies on Alcohol and Drugs,https://doi.org/10.15288/jsad.2016.77.185,409,270,PSYCHOLOGY,2016,45.44,TRUE,TRUE,TRUE
0022-0221,10.1177/0022022117698039,Sorokowska; Sorokowski; Hilpert; Cantarero; Frackowiak; Ahmadi; Alghraibeh; Aryeetey; Bertoni; Bettache; Blumen; Błażejewska; Bortolini; Butovskaya; Castro; Cetinkaya; Cunha; David; David; Dileym; Domínguez Espinosa; Donato; Dronova; Dural; Fialová; Fisher; Gulbetekin; Hamamcıoğlu Akkaya; Hromatko; Iafrate; Iesyp; James; Jaranovic; Jiang; Kimamo; Kjelvik; Koç; Laar; de Araújo Lopes; Macbeth; Marcano; Martinez; Mesko; Molodovskaya; Moradi; Motahari; Mühlhauser; Natividade; Ntayi; Oberzaucher; Ojedokun; Omar-Fauzee; Onyishi; Paluszak; Portugal; Razumiejczyk; Realo; Relvas; Rivas; Rizwan; Salkičević; Sarmány-Schuller; Schmehl; Senyk; Sinding; Stamkou; Stoyanova; Šukolová; Sutresna; Tadinac; Teras; Tinoco Ponciano; Tripathi; Tripathi; Tripathi; Uhryn; Yamamoto; Yoo; Pierce,2017,Preferred Interpersonal Distances: A Global Comparison,Journal of Cross-Cultural Psychology,https://doi.org/10.1177/0022022117698039,306,273,"PSYCHOLOGY, SOCIAL",2017,38.25,TRUE,TRUE,TRUE
0956-7976,10.1177/0956797615570365,Okonofua; Eberhardt,2015,Two Strikes,Psychological Science,https://doi.org/10.1177/0956797615570365,430,44,"PSYCHOLOGY, MULTIDISCIPLINARY",2015,43,TRUE,TRUE,TRUE
0747-5632,10.1016/j.chb.2017.01.001,Khalilzadeh; Ozturk; Bilgihan,2017,Security-related factors in extended UTAUT model for NFC based mobile payment in the restaurant industry,Computers in Human Behavior,https://doi.org/10.1016/j.chb.2017.01.001,398,12,"PSYCHOLOGY, EXPERIMENTAL",2017,49.75,TRUE,TRUE,TRUE
2397-3374,10.1038/s41562-020-0908-8,López; Rodó,2020,The end of social confinement and COVID-19 re-emergence risk,Nature Human Behaviour,https://doi.org/10.1038/s41562-020-0908-8,186,1,"PSYCHOLOGY, EXPERIMENTAL",2020,37.2,TRUE,TRUE,TRUE
1939-3792,10.1002/aur.1965,Mason; McConachie; Garland; Petrou; Rodgers; Parr,2018,Predictors of quality of life for autistic adults,Autism Research,https://doi.org/10.1002/aur.1965,224,32,"PSYCHOLOGY, DEVELOPMENTAL",2018,32,TRUE,TRUE,TRUE
1873-5843,10.1093/arclin/acaa019,Sherman; Slick; Iverson,2020,Multidimensional Malingering Criteria for Neuropsychological Assessment: A 20-Year Update of the Malingered Neuropsychological Dysfunction Criteria,Archives of Clinical Neuropsychology,https://doi.org/10.1093/arclin/acaa019,216,340,PSYCHOLOGY,2020,43.2,TRUE,TRUE,TRUE
0031-9384,10.1016/j.physbeh.2020.112964,Wiss; Brewerton,2020,Adverse Childhood Experiences and Adult Obesity: A Systematic Review of Plausible Mechanisms and Meta-Analysis of Cross-Sectional Studies,Physiology &amp; Behavior,https://doi.org/10.1016/j.physbeh.2020.112964,167,272,"PSYCHOLOGY, BIOLOGICAL",2020,33.4,TRUE,TRUE,TRUE
0027-3171,10.1080/00273171.2019.1602503,Marsh; Guo; Dicke; Parker; Craven,2020,"Confirmatory Factor Analysis (CFA), Exploratory Structural Equation Modeling (ESEM), and Set-ESEM: Optimal Balance Between Goodness of Fit and Parsimony",Multivariate Behavioral Research,https://doi.org/10.1080/00273171.2019.1602503,215,34,"PSYCHOLOGY, EXPERIMENTAL",2020,43,TRUE,TRUE,TRUE
0747-5632,10.1016/j.chb.2015.08.008,Landers; Bauer; Callan,2017,Gamification of task performance with leaderboards: A goal setting experiment,Computers in Human Behavior,https://doi.org/10.1016/j.chb.2015.08.008,265,12,"PSYCHOLOGY, EXPERIMENTAL",2017,33.13,TRUE,TRUE,TRUE
1478-0887,10.1080/14780887.2014.955224,Brooks; McCluskey; Turley; King,2015,The Utility of Template Analysis in Qualitative Psychology Research,Qualitative Research in Psychology,https://doi.org/10.1080/14780887.2014.955224,1079,53,"PSYCHOLOGY, MULTIDISCIPLINARY",2015,107.9,TRUE,TRUE,TRUE
0090-6905,10.1007/s10936-023-09974-z,Pan; Wang; Derakhshan,2023,Unpacking Chinese EFL Students’ Academic Engagement and Psychological Well-Being: The Roles of Language Teachers’ Affective Scaffolding,Journal of Psycholinguistic Research,https://doi.org/10.1007/s10936-023-09974-z,105,481,"PSYCHOLOGY, EXPERIMENTAL",2023,52.5,TRUE,TRUE,TRUE
0021-9630,10.1111/jcpp.13606,Li; Zhao; Chen; Peng; Lu,2022,Prevalence and associated factors of depression and anxiety symptoms among college students: a systematic review and meta‐analysis,Journal of Child Psychology and Psychiatry,https://doi.org/10.1111/jcpp.13606,157,19,PSYCHOLOGY,2022,52.33,TRUE,TRUE,TRUE
0747-5632,10.1016/j.chb.2015.02.059,Yildirim; Correia,2015,Exploring the dimensions of nomophobia: Development and validation of a self-reported questionnaire,Computers in Human Behavior,https://doi.org/10.1016/j.chb.2015.02.059,518,12,"PSYCHOLOGY, EXPERIMENTAL",2015,51.8,TRUE,TRUE,TRUE
0747-5632,10.1016/j.chb.2016.05.084,Rashid; Asghar,2016,"Technology use, self-directed learning, student engagement and academic performance: Examining the interrelations",Computers in Human Behavior,https://doi.org/10.1016/j.chb.2016.05.084,315,12,"PSYCHOLOGY, EXPERIMENTAL",2016,35,TRUE,TRUE,TRUE
2397-3374,10.1038/s41562-016-0021,Munafò; Nosek; Bishop; Button; Chambers; Percie du Sert; Simonsohn; Wagenmakers; Ware; Ioannidis,2017,A manifesto for reproducible science,Nature Human Behaviour,https://doi.org/10.1038/s41562-016-0021,1912,1,"PSYCHOLOGY, EXPERIMENTAL",2017,239,TRUE,TRUE,TRUE
2397-3374,10.1038/s41562-018-0385-5,Fehr; Schurtenberger,2018,Normative foundations of human cooperation,Nature Human Behaviour,https://doi.org/10.1038/s41562-018-0385-5,240,1,"PSYCHOLOGY, EXPERIMENTAL",2018,34.29,TRUE,TRUE,TRUE
0747-5632,10.1016/j.chb.2014.11.083,Fox; Moreland,2015,The dark side of social networking sites: An exploration of the relational and psychological stressors associated with Facebook use and affordances,Computers in Human Behavior,https://doi.org/10.1016/j.chb.2014.11.083,501,12,"PSYCHOLOGY, EXPERIMENTAL",2015,50.1,TRUE,TRUE,TRUE
1664-1078,10.3389/fpsyg.2022.828040,Ge; Abbas; Ullah; Abbas; Sadiq; Zhang,2022,Women’s Entrepreneurial Contribution to Family Income: Innovative Technologies Promote Females’ Entrepreneurship Amid COVID-19 Crisis,Frontiers in Psychology,https://doi.org/10.3389/fpsyg.2022.828040,112,228,"PSYCHOLOGY, MULTIDISCIPLINARY",2022,37.33,TRUE,TRUE,TRUE
1664-1078,10.3389/fpsyg.2020.575950,Taylor; Landry; Paluszek; Groenewoud; Rachor; Asmundson,2020,A Proactive Approach for Managing COVID-19: The Importance of Understanding the Motivational Roots of Vaccination Hesitancy for SARS-CoV2,Frontiers in Psychology,https://doi.org/10.3389/fpsyg.2020.575950,228,228,"PSYCHOLOGY, MULTIDISCIPLINARY",2020,45.6,TRUE,TRUE,TRUE
1557-1874,10.1007/s11469-020-00356-3,Perz; Lang; Harrington,2022,Validation of the Fear of COVID-19 Scale in a US College Sample,International Journal of Mental Health and Addiction,https://doi.org/10.1007/s11469-020-00356-3,142,131,"PSYCHOLOGY, CLINICAL",2022,47.33,TRUE,TRUE,TRUE
1521-3269,10.1080/15213269.2016.1257392,Kleemans; Daalmans; Carbaat; Anschütz,2018,Picture Perfect: The Direct Effect of Manipulated Instagram Photos on Body Image in Adolescent Girls,Media Psychology,https://doi.org/10.1080/15213269.2016.1257392,231,109,"PSYCHOLOGY, APPLIED",2018,33,TRUE,TRUE,TRUE
0149-2063,10.1177/0149206320908640,Neely; Lovelace; Cowen; Hiller,2020,Metacritiques of Upper Echelons Theory: Verdicts and Recommendations for Future Research,Journal of Management,https://doi.org/10.1177/0149206320908640,193,9,"PSYCHOLOGY, APPLIED",2020,38.6,TRUE,TRUE,TRUE
0033-2917,10.1017/s0033291717001003,Goessl; Curtiss; Hofmann,2017,The effect of heart rate variability biofeedback training on stress and anxiety: a meta-analysis,Psychological Medicine,https://doi.org/10.1017/s0033291717001003,376,26,PSYCHOLOGY,2017,47,TRUE,TRUE,TRUE
2397-3374,10.1038/s41562-020-00994-6,Gallotti; Valle; Castaldo; Sacco; De Domenico,2020,Assessing the risks of ‘infodemics’ in response to COVID-19 epidemics,Nature Human Behaviour,https://doi.org/10.1038/s41562-020-00994-6,337,1,"PSYCHOLOGY, EXPERIMENTAL",2020,67.4,TRUE,TRUE,TRUE
1018-8827,10.1007/s00787-017-1005-z,NA; Reale; Bartoli; Cartabia; Zanetti; Costantino; Canevini; Termine; Bonati,2017,Comorbidity prevalence and treatment outcome in children and adolescents with ADHD,European Child &amp; Adolescent Psychiatry,https://doi.org/10.1007/s00787-017-1005-z,288,24,"PSYCHOLOGY, DEVELOPMENTAL",2017,36,TRUE,TRUE,TRUE
